{"artifact_id":"baseline-deepseek-v4-pro-20260727-comedy_002-seed-42","artifact_type":"story-package","content_hash":"sha256:2b9912f708c2e8c7e9291b3c25ba9ae4a262dedc45febe7ce72dc547d260a66f","content_ref":"artifacts/comedy_002.story-package.json","provenance":[{"license_id":"internal-eval-0027","source_id":"comedy_002","usage":"evaluation baseline prompt"}],"schema":"story-artifact/v1"}
