{"artifact_id":"baseline-deepseek-v4-pro-20260727-workplace_003-seed-42","artifact_type":"story-package","content_hash":"sha256:08a3c75f2aa2db5b914c27770d245e453189101eed32f0b8e55f9b14c3ba2e82","content_ref":"artifacts/workplace_003.story-package.json","provenance":[{"license_id":"internal-eval-0024","source_id":"workplace_003","usage":"evaluation baseline prompt"}],"schema":"story-artifact/v1"}
