{"artifact_id":"baseline-deepseek-v4-pro-20260727-family_004-seed-42","artifact_type":"story-package","content_hash":"sha256:c1129355586e9e9b6d0aaec0dd2be56fd0bbcfeb0708e2ba4a5fec6eeb304438","content_ref":"artifacts/family_004.story-package.json","provenance":[{"license_id":"internal-eval-0014","source_id":"family_004","usage":"evaluation baseline prompt"}],"schema":"story-artifact/v1"}
