{"artifact_id":"baseline-deepseek-v4-pro-20260727-revenge_002-seed-42","artifact_type":"story-package","content_hash":"sha256:a9a816ce24dd2a4a3a0b8f0ac7c3778538a812a365062e880acdb9cdd19b2274","content_ref":"artifacts/revenge_002.story-package.json","provenance":[{"license_id":"internal-eval-0018","source_id":"revenge_002","usage":"evaluation baseline prompt"}],"schema":"story-artifact/v1"}
