{"artifact_id":"baseline-deepseek-v4-pro-20260727-urban_romance_002-seed-42","artifact_type":"story-package","content_hash":"sha256:d982cda499576cb9ad8005b13d2cd8ae7700539adbe670e5797cb9dffe47b083","content_ref":"artifacts/urban_romance_002.story-package.json","provenance":[{"license_id":"internal-eval-0004","source_id":"urban_romance_002","usage":"evaluation baseline prompt"}],"schema":"story-artifact/v1"}
