{"artifact_id":"baseline-deepseek-v4-pro-20260727-rural_003-seed-42","artifact_type":"story-package","content_hash":"sha256:8a0f126fe205565a1e6eef304a629028e14c2a10aa33ffce75d2ac75e35d39a9","content_ref":"artifacts/rural_003.story-package.json","provenance":[{"license_id":"internal-eval-0026","source_id":"rural_003","usage":"evaluation baseline prompt"}],"schema":"story-artifact/v1"}
